{
  "plan_id": "95b1fba1-425c-4d46-a63e-5ab1b8401855",
  "user_id": "auto_001",
  "run_id": "auto_run_016",
  "plan_date": "2026-04-05",
  "meals": [
    {
      "meal_type": "breakfast",
      "items": [
        {
          "food_id": "food_004",
          "food_name": "בננה",
          "quantity_g": 120.0,
          "calories_kcal": 106.8,
          "protein_g": 1.3,
          "carbs_g": 27.4,
          "fat_g": 0.4,
          "from_inventory": true,
          "inventory_item_id": "f625a059-4d35-4f35-8651-72f7a23c4441"
        },
        {
          "food_id": "food_007",
          "food_name": "לחם מחיטה מלאה",
          "quantity_g": 30.0,
          "calories_kcal": 74.1,
          "protein_g": 3.9,
          "carbs_g": 12.3,
          "fat_g": 1.0,
          "from_inventory": true,
          "inventory_item_id": "f06bd8aa-1a7b-4242-8f32-52181db9a530"
        },
        {
          "food_id": "food_017",
          "food_name": "שיבולת שועל",
          "quantity_g": 40.0,
          "calories_kcal": 155.6,
          "protein_g": 6.8,
          "carbs_g": 26.5,
          "fat_g": 2.8,
          "from_inventory": false,
          "inventory_item_id": null
        },
        {
          "food_id": "food_011",
          "food_name": "הודו",
          "quantity_g": 164.1,
          "calories_kcal": 221.5,
          "protein_g": 49.2,
          "carbs_g": 0.0,
          "fat_g": 1.6,
          "from_inventory": false,
          "inventory_item_id": null
        }
      ],
      "totals": {
        "calories_kcal": 558.0,
        "protein_g": 61.2,
        "carbs_g": 66.2,
        "fat_g": 5.8
      }
    },
    {
      "meal_type": "morning_snack",
      "items": [
        {
          "food_id": "food_024",
          "food_name": "גרעיני דלעת",
          "quantity_g": 20.0,
          "calories_kcal": 111.8,
          "protein_g": 6.0,
          "carbs_g": 2.1,
          "fat_g": 9.8,
          "from_inventory": false,
          "inventory_item_id": null
        },
        {
          "food_id": "food_025",
          "food_name": "שומשום",
          "quantity_g": 15.0,
          "calories_kcal": 86.0,
          "protein_g": 2.7,
          "carbs_g": 3.5,
          "fat_g": 7.5,
          "from_inventory": false,
          "inventory_item_id": null
        },
        {
          "food_id": "food_032",
          "food_name": "תפוז",
          "quantity_g": 54.0,
          "calories_kcal": 25.4,
          "protein_g": 0.5,
          "carbs_g": 6.5,
          "fat_g": 0.1,
          "from_inventory": false,
          "inventory_item_id": null
        }
      ],
      "totals": {
        "calories_kcal": 223.2,
        "protein_g": 9.2,
        "carbs_g": 12.1,
        "fat_g": 17.4
      }
    },
    {
      "meal_type": "lunch",
      "items": [
        {
          "food_id": "food_003",
          "food_name": "ביצה",
          "quantity_g": 50.0,
          "calories_kcal": 77.5,
          "protein_g": 6.5,
          "carbs_g": 0.6,
          "fat_g": 5.5,
          "from_inventory": true,
          "inventory_item_id": "81f7083d-6a1b-4211-ad57-4932fc20b2f1"
        },
        {
          "food_id": "food_021",
          "food_name": "פיתה",
          "quantity_g": 60.0,
          "calories_kcal": 165.0,
          "protein_g": 5.5,
          "carbs_g": 33.4,
          "fat_g": 0.7,
          "from_inventory": false,
          "inventory_item_id": null
        },
        {
          "food_id": "food_023",
          "food_name": "חמאת בוטנים",
          "quantity_g": 20.0,
          "calories_kcal": 117.6,
          "protein_g": 5.0,
          "carbs_g": 4.0,
          "fat_g": 10.0,
          "from_inventory": false,
          "inventory_item_id": null
        },
        {
          "food_id": "food_027",
          "food_name": "תרד",
          "quantity_g": 100.0,
          "calories_kcal": 23.0,
          "protein_g": 2.9,
          "carbs_g": 3.6,
          "fat_g": 0.4,
          "from_inventory": false,
          "inventory_item_id": null
        },
        {
          "food_id": "food_030",
          "food_name": "חציל",
          "quantity_g": 150.0,
          "calories_kcal": 37.5,
          "protein_g": 1.5,
          "carbs_g": 9.0,
          "fat_g": 0.3,
          "from_inventory": false,
          "inventory_item_id": null
        }
      ],
      "totals": {
        "calories_kcal": 420.6,
        "protein_g": 21.4,
        "carbs_g": 50.6,
        "fat_g": 16.9
      }
    },
    {
      "meal_type": "afternoon_snack",
      "items": [
        {
          "food_id": "food_033",
          "food_name": "תותים",
          "quantity_g": 150.0,
          "calories_kcal": 48.0,
          "protein_g": 1.0,
          "carbs_g": 11.6,
          "fat_g": 0.4,
          "from_inventory": false,
          "inventory_item_id": null
        },
        {
          "food_id": "food_034",
          "food_name": "ענבים",
          "quantity_g": 120.0,
          "calories_kcal": 82.8,
          "protein_g": 0.8,
          "carbs_g": 21.6,
          "fat_g": 0.2,
          "from_inventory": false,
          "inventory_item_id": null
        },
        {
          "food_id": "food_035",
          "food_name": "אבטיח",
          "quantity_g": 200.0,
          "calories_kcal": 60.0,
          "protein_g": 1.2,
          "carbs_g": 15.2,
          "fat_g": 0.4,
          "from_inventory": false,
          "inventory_item_id": null
        },
        {
          "food_id": "food_070",
          "food_name": "חלב סויה",
          "quantity_g": 98.2,
          "calories_kcal": 32.4,
          "protein_g": 2.7,
          "carbs_g": 1.8,
          "fat_g": 1.8,
          "from_inventory": false,
          "inventory_item_id": null
        }
      ],
      "totals": {
        "calories_kcal": 223.2,
        "protein_g": 5.7,
        "carbs_g": 50.2,
        "fat_g": 2.8
      }
    },
    {
      "meal_type": "dinner",
      "items": [
        {
          "food_id": "food_048",
          "food_name": "שעועית שחורה",
          "quantity_g": 150.0,
          "calories_kcal": 198.0,
          "protein_g": 13.4,
          "carbs_g": 35.5,
          "fat_g": 0.8,
          "from_inventory": false,
          "inventory_item_id": null
        },
        {
          "food_id": "food_051",
          "food_name": "אדממה",
          "quantity_g": 100.0,
          "calories_kcal": 121.0,
          "protein_g": 11.9,
          "carbs_g": 8.6,
          "fat_g": 5.2,
          "from_inventory": false,
          "inventory_item_id": null
        },
        {
          "food_id": "food_076",
          "food_name": "חסה",
          "quantity_g": 80.0,
          "calories_kcal": 12.0,
          "protein_g": 1.1,
          "carbs_g": 2.3,
          "fat_g": 0.2,
          "from_inventory": false,
          "inventory_item_id": null
        },
        {
          "food_id": "food_077",
          "food_name": "כרובית",
          "quantity_g": 150.0,
          "calories_kcal": 37.5,
          "protein_g": 2.8,
          "carbs_g": 7.5,
          "fat_g": 0.4,
          "from_inventory": false,
          "inventory_item_id": null
        },
        {
          "food_id": "food_078",
          "food_name": "בצל",
          "quantity_g": 80.0,
          "calories_kcal": 32.0,
          "protein_g": 0.9,
          "carbs_g": 7.4,
          "fat_g": 0.1,
          "from_inventory": false,
          "inventory_item_id": null
        }
      ],
      "totals": {
        "calories_kcal": 400.5,
        "protein_g": 30.1,
        "carbs_g": 61.3,
        "fat_g": 6.7
      }
    }
  ],
  "target_calories_kcal": 2231.9,
  "totals": {
    "calories_kcal": 1825.5,
    "protein_g": 127.6,
    "carbs_g": 240.4,
    "fat_g": 49.6
  },
  "calorie_deviation_pct": -18.2,
  "created_at": "2026-04-05T11:34:55.010380+00:00"
}