{
  "plan_id": "4e96937c-3e63-4605-a3a9-53eb06b20dad",
  "user_id": "variety_test",
  "run_id": "variety_run_1",
  "plan_date": "2026-04-08",
  "meals": [
    {
      "meal_type": "breakfast",
      "items": [
        {
          "food_id": "food_008",
          "food_name": "עגבנייה",
          "quantity_g": 120.0,
          "calories_kcal": 21.6,
          "protein_g": 1.1,
          "carbs_g": 4.7,
          "fat_g": 0.2,
          "from_inventory": false,
          "inventory_item_id": null
        },
        {
          "food_id": "food_009",
          "food_name": "מלפפון",
          "quantity_g": 100.0,
          "calories_kcal": 15.0,
          "protein_g": 0.7,
          "carbs_g": 3.6,
          "fat_g": 0.1,
          "from_inventory": false,
          "inventory_item_id": null
        },
        {
          "food_id": "food_010",
          "food_name": "גבינת קוטג׳",
          "quantity_g": 100.0,
          "calories_kcal": 98.0,
          "protein_g": 11.0,
          "carbs_g": 3.4,
          "fat_g": 4.3,
          "from_inventory": false,
          "inventory_item_id": null
        },
        {
          "food_id": "food_017",
          "food_name": "שיבולת שועל",
          "quantity_g": 40.0,
          "calories_kcal": 155.6,
          "protein_g": 6.8,
          "carbs_g": 26.5,
          "fat_g": 2.8,
          "from_inventory": false,
          "inventory_item_id": null
        },
        {
          "food_id": "food_018",
          "food_name": "פסטה",
          "quantity_g": 200.0,
          "calories_kcal": 262.0,
          "protein_g": 10.0,
          "carbs_g": 50.0,
          "fat_g": 2.2,
          "from_inventory": false,
          "inventory_item_id": null
        }
      ],
      "totals": {
        "calories_kcal": 552.2,
        "protein_g": 29.6,
        "carbs_g": 88.2,
        "fat_g": 9.6
      }
    },
    {
      "meal_type": "morning_snack",
      "items": [
        {
          "food_id": "food_031",
          "food_name": "תפוח",
          "quantity_g": 150.0,
          "calories_kcal": 78.0,
          "protein_g": 0.4,
          "carbs_g": 21.0,
          "fat_g": 0.3,
          "from_inventory": false,
          "inventory_item_id": null
        },
        {
          "food_id": "food_037",
          "food_name": "יוגורט יווני",
          "quantity_g": 170.0,
          "calories_kcal": 100.3,
          "protein_g": 17.0,
          "carbs_g": 6.1,
          "fat_g": 1.2,
          "from_inventory": false,
          "inventory_item_id": null
        },
        {
          "food_id": "food_056",
          "food_name": "קשיו",
          "quantity_g": 14.5,
          "calories_kcal": 80.2,
          "protein_g": 2.6,
          "carbs_g": 4.4,
          "fat_g": 6.4,
          "from_inventory": false,
          "inventory_item_id": null
        }
      ],
      "totals": {
        "calories_kcal": 258.5,
        "protein_g": 20.0,
        "carbs_g": 31.5,
        "fat_g": 7.9
      }
    },
    {
      "meal_type": "lunch",
      "items": [
        {
          "food_id": "food_013",
          "food_name": "סלמון",
          "quantity_g": 150.0,
          "calories_kcal": 312.0,
          "protein_g": 30.0,
          "carbs_g": 0.0,
          "fat_g": 19.5,
          "from_inventory": false,
          "inventory_item_id": null
        },
        {
          "food_id": "food_014",
          "food_name": "בקר טחון",
          "quantity_g": 150.0,
          "calories_kcal": 375.0,
          "protein_g": 39.0,
          "carbs_g": 0.0,
          "fat_g": 22.5,
          "from_inventory": false,
          "inventory_item_id": null
        },
        {
          "food_id": "food_015",
          "food_name": "טופו",
          "quantity_g": 150.0,
          "calories_kcal": 114.0,
          "protein_g": 12.0,
          "carbs_g": 2.8,
          "fat_g": 7.2,
          "from_inventory": false,
          "inventory_item_id": null
        },
        {
          "food_id": "food_016",
          "food_name": "בטטה",
          "quantity_g": 121.3,
          "calories_kcal": 104.3,
          "protein_g": 1.9,
          "carbs_g": 24.3,
          "fat_g": 0.1,
          "from_inventory": false,
          "inventory_item_id": null
        }
      ],
      "totals": {
        "calories_kcal": 905.3,
        "protein_g": 82.9,
        "carbs_g": 27.1,
        "fat_g": 49.3
      }
    },
    {
      "meal_type": "afternoon_snack",
      "items": [
        {
          "food_id": "food_019",
          "food_name": "קינואה",
          "quantity_g": 150.0,
          "calories_kcal": 180.0,
          "protein_g": 6.6,
          "carbs_g": 32.0,
          "fat_g": 2.8,
          "from_inventory": false,
          "inventory_item_id": null
        },
        {
          "food_id": "food_021",
          "food_name": "פיתה",
          "quantity_g": 28.6,
          "calories_kcal": 78.7,
          "protein_g": 2.6,
          "carbs_g": 15.9,
          "fat_g": 0.3,
          "from_inventory": false,
          "inventory_item_id": null
        }
      ],
      "totals": {
        "calories_kcal": 258.7,
        "protein_g": 9.2,
        "carbs_g": 47.9,
        "fat_g": 3.1
      }
    },
    {
      "meal_type": "dinner",
      "items": [
        {
          "food_id": "food_026",
          "food_name": "ברוקולי",
          "quantity_g": 150.0,
          "calories_kcal": 51.0,
          "protein_g": 4.2,
          "carbs_g": 10.5,
          "fat_g": 0.6,
          "from_inventory": false,
          "inventory_item_id": null
        },
        {
          "food_id": "food_084",
          "food_name": "ביצה",
          "quantity_g": 50.0,
          "calories_kcal": 77.5,
          "protein_g": 6.5,
          "carbs_g": 0.6,
          "fat_g": 5.5,
          "from_inventory": false,
          "inventory_item_id": null
        },
        {
          "food_id": "food_087",
          "food_name": "לחם מחיטה מלאה",
          "quantity_g": 30.0,
          "calories_kcal": 75.6,
          "protein_g": 3.6,
          "carbs_g": 12.9,
          "fat_g": 1.1,
          "from_inventory": false,
          "inventory_item_id": null
        },
        {
          "food_id": "food_088",
          "food_name": "טורטייה",
          "quantity_g": 60.0,
          "calories_kcal": 187.2,
          "protein_g": 4.8,
          "carbs_g": 31.2,
          "fat_g": 4.8,
          "from_inventory": false,
          "inventory_item_id": null
        },
        {
          "food_id": "food_089",
          "food_name": "שמן זית",
          "quantity_g": 10.0,
          "calories_kcal": 88.4,
          "protein_g": 0.0,
          "carbs_g": 0.0,
          "fat_g": 10.0,
          "from_inventory": false,
          "inventory_item_id": null
        }
      ],
      "totals": {
        "calories_kcal": 479.7,
        "protein_g": 19.1,
        "carbs_g": 55.2,
        "fat_g": 22.0
      }
    }
  ],
  "target_calories_kcal": 2586.6,
  "totals": {
    "calories_kcal": 2454.4,
    "protein_g": 160.8,
    "carbs_g": 249.9,
    "fat_g": 91.9
  },
  "calorie_deviation_pct": -5.1,
  "created_at": "2026-04-08T15:01:50.983909+00:00"
}