{
  "plan_id": "87ced753-07b3-4b7a-bb8c-e51ed641113e",
  "user_id": "auto_001",
  "run_id": "auto_run_010",
  "plan_date": "2026-04-11",
  "meals": [
    {
      "meal_type": "breakfast",
      "items": [
        {
          "food_id": "food_011",
          "food_name": "הודו",
          "quantity_g": 144.4,
          "calories_kcal": 194.9,
          "protein_g": 43.3,
          "carbs_g": 0.0,
          "fat_g": 1.4,
          "from_inventory": false,
          "inventory_item_id": null
        },
        {
          "food_id": "food_004",
          "food_name": "בננה",
          "quantity_g": 120.0,
          "calories_kcal": 106.8,
          "protein_g": 1.3,
          "carbs_g": 27.4,
          "fat_g": 0.4,
          "from_inventory": true,
          "inventory_item_id": "4a1a4cb5-8077-469a-9c84-5765926a9dff"
        },
        {
          "food_id": "food_007",
          "food_name": "לחם מחיטה מלאה",
          "quantity_g": 30.0,
          "calories_kcal": 74.1,
          "protein_g": 3.9,
          "carbs_g": 12.3,
          "fat_g": 1.0,
          "from_inventory": true,
          "inventory_item_id": "42c6a301-9b64-4e17-ad72-97538a4f7f3d"
        },
        {
          "food_id": "food_031",
          "food_name": "תפוח",
          "quantity_g": 150.0,
          "calories_kcal": 78.0,
          "protein_g": 0.4,
          "carbs_g": 21.0,
          "fat_g": 0.3,
          "from_inventory": false,
          "inventory_item_id": null
        },
        {
          "food_id": "food_026",
          "food_name": "ברוקולי",
          "quantity_g": 150.0,
          "calories_kcal": 51.0,
          "protein_g": 4.2,
          "carbs_g": 10.5,
          "fat_g": 0.6,
          "from_inventory": false,
          "inventory_item_id": null
        }
      ],
      "totals": {
        "calories_kcal": 504.8,
        "protein_g": 53.1,
        "carbs_g": 71.2,
        "fat_g": 3.7
      }
    },
    {
      "meal_type": "morning_snack",
      "items": [
        {
          "food_id": "food_006",
          "food_name": "חלב",
          "quantity_g": 250.0,
          "calories_kcal": 105.0,
          "protein_g": 8.5,
          "carbs_g": 12.5,
          "fat_g": 2.5,
          "from_inventory": false,
          "inventory_item_id": null
        },
        {
          "food_id": "food_025",
          "food_name": "שומשום",
          "quantity_g": 15.0,
          "calories_kcal": 86.0,
          "protein_g": 2.7,
          "carbs_g": 3.5,
          "fat_g": 7.5,
          "from_inventory": false,
          "inventory_item_id": null
        },
        {
          "food_id": "food_039",
          "food_name": "לבנה",
          "quantity_g": 21.5,
          "calories_kcal": 32.2,
          "protein_g": 1.3,
          "carbs_g": 0.9,
          "fat_g": 2.6,
          "from_inventory": false,
          "inventory_item_id": null
        }
      ],
      "totals": {
        "calories_kcal": 223.2,
        "protein_g": 12.5,
        "carbs_g": 16.9,
        "fat_g": 12.6
      }
    },
    {
      "meal_type": "lunch",
      "items": [
        {
          "food_id": "food_001",
          "food_name": "חזה עוף",
          "quantity_g": 150.0,
          "calories_kcal": 247.5,
          "protein_g": 46.5,
          "carbs_g": 0.0,
          "fat_g": 5.4,
          "from_inventory": true,
          "inventory_item_id": "5519cce0-2a3b-47ea-84c3-8eee666be047"
        },
        {
          "food_id": "food_003",
          "food_name": "ביצה",
          "quantity_g": 50.0,
          "calories_kcal": 77.5,
          "protein_g": 6.5,
          "carbs_g": 0.6,
          "fat_g": 5.5,
          "from_inventory": true,
          "inventory_item_id": "7b9abc64-cda8-49ce-a45e-be4a4f7ec953"
        },
        {
          "food_id": "food_017",
          "food_name": "שיבולת שועל",
          "quantity_g": 40.0,
          "calories_kcal": 155.6,
          "protein_g": 6.8,
          "carbs_g": 26.5,
          "fat_g": 2.8,
          "from_inventory": false,
          "inventory_item_id": null
        },
        {
          "food_id": "food_018",
          "food_name": "פסטה",
          "quantity_g": 200.0,
          "calories_kcal": 262.0,
          "protein_g": 10.0,
          "carbs_g": 50.0,
          "fat_g": 2.2,
          "from_inventory": false,
          "inventory_item_id": null
        },
        {
          "food_id": "food_020",
          "food_name": "תפוח אדמה",
          "quantity_g": 50.1,
          "calories_kcal": 38.6,
          "protein_g": 1.0,
          "carbs_g": 8.5,
          "fat_g": 0.1,
          "from_inventory": false,
          "inventory_item_id": null
        }
      ],
      "totals": {
        "calories_kcal": 781.2,
        "protein_g": 70.8,
        "carbs_g": 85.6,
        "fat_g": 16.0
      }
    },
    {
      "meal_type": "afternoon_snack",
      "items": [
        {
          "food_id": "food_072",
          "food_name": "דבש",
          "quantity_g": 15.0,
          "calories_kcal": 45.6,
          "protein_g": 0.0,
          "carbs_g": 12.3,
          "fat_g": 0.0,
          "from_inventory": false,
          "inventory_item_id": null
        },
        {
          "food_id": "food_080",
          "food_name": "לימון",
          "quantity_g": 30.0,
          "calories_kcal": 8.7,
          "protein_g": 0.3,
          "carbs_g": 2.8,
          "fat_g": 0.1,
          "from_inventory": false,
          "inventory_item_id": null
        },
        {
          "food_id": "food_085",
          "food_name": "קוטג'",
          "quantity_g": 150.0,
          "calories_kcal": 147.0,
          "protein_g": 16.5,
          "carbs_g": 5.1,
          "fat_g": 6.4,
          "from_inventory": false,
          "inventory_item_id": null
        },
        {
          "food_id": "food_086",
          "food_name": "חלב",
          "quantity_g": 36.5,
          "calories_kcal": 21.9,
          "protein_g": 1.2,
          "carbs_g": 1.8,
          "fat_g": 1.1,
          "from_inventory": false,
          "inventory_item_id": null
        }
      ],
      "totals": {
        "calories_kcal": 223.2,
        "protein_g": 18.0,
        "carbs_g": 22.0,
        "fat_g": 7.6
      }
    },
    {
      "meal_type": "dinner",
      "items": [
        {
          "food_id": "food_022",
          "food_name": "אבוקדו",
          "quantity_g": 80.0,
          "calories_kcal": 128.0,
          "protein_g": 1.6,
          "carbs_g": 6.8,
          "fat_g": 11.8,
          "from_inventory": false,
          "inventory_item_id": null
        },
        {
          "food_id": "food_023",
          "food_name": "חמאת בוטנים",
          "quantity_g": 20.0,
          "calories_kcal": 117.6,
          "protein_g": 5.0,
          "carbs_g": 4.0,
          "fat_g": 10.0,
          "from_inventory": false,
          "inventory_item_id": null
        },
        {
          "food_id": "food_028",
          "food_name": "פלפל אדום",
          "quantity_g": 120.0,
          "calories_kcal": 37.2,
          "protein_g": 1.2,
          "carbs_g": 7.2,
          "fat_g": 0.4,
          "from_inventory": false,
          "inventory_item_id": null
        },
        {
          "food_id": "food_079",
          "food_name": "שום",
          "quantity_g": 10.0,
          "calories_kcal": 14.9,
          "protein_g": 0.6,
          "carbs_g": 3.3,
          "fat_g": 0.1,
          "from_inventory": false,
          "inventory_item_id": null
        },
        {
          "food_id": "food_081",
          "food_name": "פטרוזיליה",
          "quantity_g": 10.0,
          "calories_kcal": 3.6,
          "protein_g": 0.3,
          "carbs_g": 0.6,
          "fat_g": 0.1,
          "from_inventory": false,
          "inventory_item_id": null
        }
      ],
      "totals": {
        "calories_kcal": 301.3,
        "protein_g": 8.7,
        "carbs_g": 21.9,
        "fat_g": 22.4
      }
    }
  ],
  "target_calories_kcal": 2231.9,
  "totals": {
    "calories_kcal": 2033.7,
    "protein_g": 163.1,
    "carbs_g": 217.6,
    "fat_g": 62.3
  },
  "calorie_deviation_pct": -8.9,
  "created_at": "2026-04-11T12:05:27.322652+00:00"
}