{
  "plan_id": "02d5b89e-a4d6-45f1-9b1c-257308eb1f9a",
  "user_id": "auto_001",
  "run_id": "auto_run_012",
  "plan_date": "2026-04-06",
  "meals": [
    {
      "meal_type": "breakfast",
      "items": [
        {
          "food_id": "food_002",
          "food_name": "אורז לבן",
          "quantity_g": 150.0,
          "calories_kcal": 195.0,
          "protein_g": 4.1,
          "carbs_g": 42.0,
          "fat_g": 0.4,
          "from_inventory": true,
          "inventory_item_id": "5d0246d6-7e09-4b45-b451-b5620044153b"
        },
        {
          "food_id": "food_004",
          "food_name": "בננה",
          "quantity_g": 120.0,
          "calories_kcal": 106.8,
          "protein_g": 1.3,
          "carbs_g": 27.4,
          "fat_g": 0.4,
          "from_inventory": true,
          "inventory_item_id": "926d8c53-2705-4989-9575-4257008e3daf"
        },
        {
          "food_id": "food_007",
          "food_name": "לחם מחיטה מלאה",
          "quantity_g": 30.0,
          "calories_kcal": 74.1,
          "protein_g": 3.9,
          "carbs_g": 12.3,
          "fat_g": 1.0,
          "from_inventory": true,
          "inventory_item_id": "2203c46f-5584-4ba8-8193-1d780382e5ee"
        },
        {
          "food_id": "food_008",
          "food_name": "עגבנייה",
          "quantity_g": 120.0,
          "calories_kcal": 21.6,
          "protein_g": 1.1,
          "carbs_g": 4.7,
          "fat_g": 0.2,
          "from_inventory": true,
          "inventory_item_id": "d68311a0-ecb2-4e61-aa12-6678e1f0c577"
        },
        {
          "food_id": "food_010",
          "food_name": "גבינת קוטג׳",
          "quantity_g": 100.0,
          "calories_kcal": 98.0,
          "protein_g": 11.0,
          "carbs_g": 3.4,
          "fat_g": 4.3,
          "from_inventory": true,
          "inventory_item_id": "3d2a54de-bae6-4d2e-8cfe-92a98bdf1e7f"
        }
      ],
      "totals": {
        "calories_kcal": 495.5,
        "protein_g": 21.4,
        "carbs_g": 89.8,
        "fat_g": 6.3
      }
    },
    {
      "meal_type": "morning_snack",
      "items": [
        {
          "food_id": "food_006",
          "food_name": "חלב",
          "quantity_g": 250.0,
          "calories_kcal": 105.0,
          "protein_g": 8.5,
          "carbs_g": 12.5,
          "fat_g": 2.5,
          "from_inventory": false,
          "inventory_item_id": null
        },
        {
          "food_id": "food_038",
          "food_name": "גבינה צהובה",
          "quantity_g": 30.0,
          "calories_kcal": 105.0,
          "protein_g": 7.5,
          "carbs_g": 0.4,
          "fat_g": 8.1,
          "from_inventory": false,
          "inventory_item_id": null
        },
        {
          "food_id": "food_040",
          "food_name": "גבינה בולגרית",
          "quantity_g": 10.0,
          "calories_kcal": 24.0,
          "protein_g": 1.4,
          "carbs_g": 0.1,
          "fat_g": 2.0,
          "from_inventory": false,
          "inventory_item_id": null
        }
      ],
      "totals": {
        "calories_kcal": 234.0,
        "protein_g": 17.4,
        "carbs_g": 13.0,
        "fat_g": 12.6
      }
    },
    {
      "meal_type": "lunch",
      "items": [
        {
          "food_id": "food_003",
          "food_name": "ביצה",
          "quantity_g": 50.0,
          "calories_kcal": 77.5,
          "protein_g": 6.5,
          "carbs_g": 0.6,
          "fat_g": 5.5,
          "from_inventory": true,
          "inventory_item_id": "44b646ea-b24e-4baf-8add-6bdcf0e90a5b"
        },
        {
          "food_id": "food_013",
          "food_name": "סלמון",
          "quantity_g": 150.0,
          "calories_kcal": 312.0,
          "protein_g": 30.0,
          "carbs_g": 0.0,
          "fat_g": 19.5,
          "from_inventory": true,
          "inventory_item_id": "d1db80bd-29e7-45ba-b01d-97da526e6f1f"
        },
        {
          "food_id": "food_026",
          "food_name": "ברוקולי",
          "quantity_g": 150.0,
          "calories_kcal": 51.0,
          "protein_g": 4.2,
          "carbs_g": 10.5,
          "fat_g": 0.6,
          "from_inventory": false,
          "inventory_item_id": null
        },
        {
          "food_id": "food_014",
          "food_name": "בקר טחון",
          "quantity_g": 136.3,
          "calories_kcal": 340.8,
          "protein_g": 35.4,
          "carbs_g": 0.0,
          "fat_g": 20.4,
          "from_inventory": false,
          "inventory_item_id": null
        }
      ],
      "totals": {
        "calories_kcal": 781.3,
        "protein_g": 76.1,
        "carbs_g": 11.1,
        "fat_g": 46.0
      }
    },
    {
      "meal_type": "afternoon_snack",
      "items": [
        {
          "food_id": "food_017",
          "food_name": "שיבולת שועל",
          "quantity_g": 40.0,
          "calories_kcal": 155.6,
          "protein_g": 6.8,
          "carbs_g": 26.5,
          "fat_g": 2.8,
          "from_inventory": false,
          "inventory_item_id": null
        },
        {
          "food_id": "food_018",
          "food_name": "פסטה",
          "quantity_g": 51.6,
          "calories_kcal": 67.6,
          "protein_g": 2.6,
          "carbs_g": 12.9,
          "fat_g": 0.6,
          "from_inventory": false,
          "inventory_item_id": null
        }
      ],
      "totals": {
        "calories_kcal": 223.2,
        "protein_g": 9.4,
        "carbs_g": 39.4,
        "fat_g": 3.4
      }
    },
    {
      "meal_type": "dinner",
      "items": [
        {
          "food_id": "food_021",
          "food_name": "פיתה",
          "quantity_g": 60.0,
          "calories_kcal": 165.0,
          "protein_g": 5.5,
          "carbs_g": 33.4,
          "fat_g": 0.7,
          "from_inventory": false,
          "inventory_item_id": null
        },
        {
          "food_id": "food_022",
          "food_name": "אבוקדו",
          "quantity_g": 80.0,
          "calories_kcal": 128.0,
          "protein_g": 1.6,
          "carbs_g": 6.8,
          "fat_g": 11.8,
          "from_inventory": false,
          "inventory_item_id": null
        },
        {
          "food_id": "food_029",
          "food_name": "גזר",
          "quantity_g": 100.0,
          "calories_kcal": 41.0,
          "protein_g": 0.9,
          "carbs_g": 9.6,
          "fat_g": 0.2,
          "from_inventory": false,
          "inventory_item_id": null
        },
        {
          "food_id": "food_049",
          "food_name": "אפונה ירוקה",
          "quantity_g": 100.0,
          "calories_kcal": 81.0,
          "protein_g": 5.4,
          "carbs_g": 14.5,
          "fat_g": 0.4,
          "from_inventory": false,
          "inventory_item_id": null
        },
        {
          "food_id": "food_050",
          "food_name": "שעועית לבנה",
          "quantity_g": 22.6,
          "calories_kcal": 31.4,
          "protein_g": 2.2,
          "carbs_g": 5.7,
          "fat_g": 0.1,
          "from_inventory": false,
          "inventory_item_id": null
        }
      ],
      "totals": {
        "calories_kcal": 446.4,
        "protein_g": 15.6,
        "carbs_g": 70.0,
        "fat_g": 13.2
      }
    }
  ],
  "target_calories_kcal": 2231.9,
  "totals": {
    "calories_kcal": 2180.4,
    "protein_g": 139.9,
    "carbs_g": 223.3,
    "fat_g": 81.5
  },
  "calorie_deviation_pct": -2.3,
  "created_at": "2026-04-06T14:51:25.684674+00:00"
}