{
  "plan_id": "a7cbce3d-024e-41f4-ad3c-4df18acc6e42",
  "user_id": "variety_test",
  "run_id": "variety_run_0",
  "plan_date": "2026-04-14",
  "meals": [
    {
      "meal_type": "breakfast",
      "items": [
        {
          "food_id": "food_012",
          "food_name": "טונה",
          "quantity_g": 92.1,
          "calories_kcal": 106.8,
          "protein_g": 23.5,
          "carbs_g": 0.0,
          "fat_g": 0.9,
          "from_inventory": false,
          "inventory_item_id": null
        },
        {
          "food_id": "food_006",
          "food_name": "חלב",
          "quantity_g": 250.0,
          "calories_kcal": 105.0,
          "protein_g": 8.5,
          "carbs_g": 12.5,
          "fat_g": 2.5,
          "from_inventory": false,
          "inventory_item_id": null
        },
        {
          "food_id": "food_007",
          "food_name": "לחם מחיטה מלאה",
          "quantity_g": 30.0,
          "calories_kcal": 74.1,
          "protein_g": 3.9,
          "carbs_g": 12.3,
          "fat_g": 1.0,
          "from_inventory": false,
          "inventory_item_id": null
        },
        {
          "food_id": "food_017",
          "food_name": "שיבולת שועל",
          "quantity_g": 40.0,
          "calories_kcal": 155.6,
          "protein_g": 6.8,
          "carbs_g": 26.5,
          "fat_g": 2.8,
          "from_inventory": false,
          "inventory_item_id": null
        },
        {
          "food_id": "food_011",
          "food_name": "הודו",
          "quantity_g": 122.2,
          "calories_kcal": 165.0,
          "protein_g": 36.7,
          "carbs_g": 0.0,
          "fat_g": 1.2,
          "from_inventory": false,
          "inventory_item_id": null
        }
      ],
      "totals": {
        "calories_kcal": 606.5,
        "protein_g": 79.4,
        "carbs_g": 51.3,
        "fat_g": 8.4
      }
    },
    {
      "meal_type": "morning_snack",
      "items": [
        {
          "food_id": "food_025",
          "food_name": "שומשום",
          "quantity_g": 15.0,
          "calories_kcal": 86.0,
          "protein_g": 2.7,
          "carbs_g": 3.5,
          "fat_g": 7.5,
          "from_inventory": false,
          "inventory_item_id": null
        },
        {
          "food_id": "food_031",
          "food_name": "תפוח",
          "quantity_g": 150.0,
          "calories_kcal": 78.0,
          "protein_g": 0.4,
          "carbs_g": 21.0,
          "fat_g": 0.3,
          "from_inventory": false,
          "inventory_item_id": null
        },
        {
          "food_id": "food_032",
          "food_name": "תפוז",
          "quantity_g": 150.0,
          "calories_kcal": 70.5,
          "protein_g": 1.4,
          "carbs_g": 18.0,
          "fat_g": 0.2,
          "from_inventory": false,
          "inventory_item_id": null
        },
        {
          "food_id": "food_033",
          "food_name": "תותים",
          "quantity_g": 75.5,
          "calories_kcal": 24.2,
          "protein_g": 0.5,
          "carbs_g": 5.8,
          "fat_g": 0.2,
          "from_inventory": false,
          "inventory_item_id": null
        }
      ],
      "totals": {
        "calories_kcal": 258.7,
        "protein_g": 5.0,
        "carbs_g": 48.3,
        "fat_g": 8.2
      }
    },
    {
      "meal_type": "lunch",
      "items": [
        {
          "food_id": "food_023",
          "food_name": "חמאת בוטנים",
          "quantity_g": 20.0,
          "calories_kcal": 117.6,
          "protein_g": 5.0,
          "carbs_g": 4.0,
          "fat_g": 10.0,
          "from_inventory": false,
          "inventory_item_id": null
        },
        {
          "food_id": "food_026",
          "food_name": "ברוקולי",
          "quantity_g": 150.0,
          "calories_kcal": 51.0,
          "protein_g": 4.2,
          "carbs_g": 10.5,
          "fat_g": 0.6,
          "from_inventory": false,
          "inventory_item_id": null
        },
        {
          "food_id": "food_028",
          "food_name": "פלפל אדום",
          "quantity_g": 120.0,
          "calories_kcal": 37.2,
          "protein_g": 1.2,
          "carbs_g": 7.2,
          "fat_g": 0.4,
          "from_inventory": false,
          "inventory_item_id": null
        },
        {
          "food_id": "food_029",
          "food_name": "גזר",
          "quantity_g": 100.0,
          "calories_kcal": 41.0,
          "protein_g": 0.9,
          "carbs_g": 9.6,
          "fat_g": 0.2,
          "from_inventory": false,
          "inventory_item_id": null
        },
        {
          "food_id": "food_030",
          "food_name": "חציל",
          "quantity_g": 150.0,
          "calories_kcal": 37.5,
          "protein_g": 1.5,
          "carbs_g": 9.0,
          "fat_g": 0.3,
          "from_inventory": false,
          "inventory_item_id": null
        }
      ],
      "totals": {
        "calories_kcal": 284.3,
        "protein_g": 12.8,
        "carbs_g": 40.3,
        "fat_g": 11.5
      }
    },
    {
      "meal_type": "afternoon_snack",
      "items": [
        {
          "food_id": "food_034",
          "food_name": "ענבים",
          "quantity_g": 120.0,
          "calories_kcal": 82.8,
          "protein_g": 0.8,
          "carbs_g": 21.6,
          "fat_g": 0.2,
          "from_inventory": false,
          "inventory_item_id": null
        },
        {
          "food_id": "food_041",
          "food_name": "שמנת חמוצה",
          "quantity_g": 30.0,
          "calories_kcal": 57.9,
          "protein_g": 0.6,
          "carbs_g": 1.4,
          "fat_g": 5.7,
          "from_inventory": false,
          "inventory_item_id": null
        },
        {
          "food_id": "food_044",
          "food_name": "קוסקוס",
          "quantity_g": 105.3,
          "calories_kcal": 117.9,
          "protein_g": 4.0,
          "carbs_g": 24.4,
          "fat_g": 0.2,
          "from_inventory": false,
          "inventory_item_id": null
        }
      ],
      "totals": {
        "calories_kcal": 258.6,
        "protein_g": 5.4,
        "carbs_g": 47.4,
        "fat_g": 6.1
      }
    },
    {
      "meal_type": "dinner",
      "items": [
        {
          "food_id": "food_045",
          "food_name": "אורז חום",
          "quantity_g": 150.0,
          "calories_kcal": 166.5,
          "protein_g": 3.9,
          "carbs_g": 34.5,
          "fat_g": 1.4,
          "from_inventory": false,
          "inventory_item_id": null
        },
        {
          "food_id": "food_077",
          "food_name": "כרובית",
          "quantity_g": 150.0,
          "calories_kcal": 37.5,
          "protein_g": 2.8,
          "carbs_g": 7.5,
          "fat_g": 0.4,
          "from_inventory": false,
          "inventory_item_id": null
        },
        {
          "food_id": "food_078",
          "food_name": "בצל",
          "quantity_g": 80.0,
          "calories_kcal": 32.0,
          "protein_g": 0.9,
          "carbs_g": 7.4,
          "fat_g": 0.1,
          "from_inventory": false,
          "inventory_item_id": null
        },
        {
          "food_id": "food_079",
          "food_name": "שום",
          "quantity_g": 10.0,
          "calories_kcal": 14.9,
          "protein_g": 0.6,
          "carbs_g": 3.3,
          "fat_g": 0.1,
          "from_inventory": false,
          "inventory_item_id": null
        },
        {
          "food_id": "food_081",
          "food_name": "פטרוזיליה",
          "quantity_g": 10.0,
          "calories_kcal": 3.6,
          "protein_g": 0.3,
          "carbs_g": 0.6,
          "fat_g": 0.1,
          "from_inventory": false,
          "inventory_item_id": null
        }
      ],
      "totals": {
        "calories_kcal": 254.5,
        "protein_g": 8.5,
        "carbs_g": 53.3,
        "fat_g": 2.1
      }
    }
  ],
  "target_calories_kcal": 2586.6,
  "totals": {
    "calories_kcal": 1662.6,
    "protein_g": 111.1,
    "carbs_g": 240.6,
    "fat_g": 36.3
  },
  "calorie_deviation_pct": -35.7,
  "created_at": "2026-04-14T12:07:38.548091+00:00"
}