{
  "plan_id": "5cc05d60-e042-4822-b23b-63f9c4703347",
  "user_id": "auto_001",
  "run_id": "auto_run_015",
  "plan_date": "2026-04-05",
  "meals": [
    {
      "meal_type": "breakfast",
      "items": [
        {
          "food_id": "food_008",
          "food_name": "עגבנייה",
          "quantity_g": 120.0,
          "calories_kcal": 21.6,
          "protein_g": 1.1,
          "carbs_g": 4.7,
          "fat_g": 0.2,
          "from_inventory": true,
          "inventory_item_id": "88f4bf02-24df-405e-ac09-9165fd0621dc"
        },
        {
          "food_id": "food_010",
          "food_name": "גבינת קוטג׳",
          "quantity_g": 100.0,
          "calories_kcal": 98.0,
          "protein_g": 11.0,
          "carbs_g": 3.4,
          "fat_g": 4.3,
          "from_inventory": true,
          "inventory_item_id": "256785fa-3bde-4986-aa0c-520b6629cf25"
        },
        {
          "food_id": "food_029",
          "food_name": "גזר",
          "quantity_g": 100.0,
          "calories_kcal": 41.0,
          "protein_g": 0.9,
          "carbs_g": 9.6,
          "fat_g": 0.2,
          "from_inventory": false,
          "inventory_item_id": null
        },
        {
          "food_id": "food_043",
          "food_name": "בורגול",
          "quantity_g": 150.0,
          "calories_kcal": 124.5,
          "protein_g": 4.7,
          "carbs_g": 27.9,
          "fat_g": 0.3,
          "from_inventory": false,
          "inventory_item_id": null
        },
        {
          "food_id": "food_044",
          "food_name": "קוסקוס",
          "quantity_g": 150.0,
          "calories_kcal": 168.0,
          "protein_g": 5.7,
          "carbs_g": 34.8,
          "fat_g": 0.3,
          "from_inventory": false,
          "inventory_item_id": null
        }
      ],
      "totals": {
        "calories_kcal": 453.1,
        "protein_g": 23.4,
        "carbs_g": 80.4,
        "fat_g": 5.3
      }
    },
    {
      "meal_type": "morning_snack",
      "items": [
        {
          "food_id": "food_056",
          "food_name": "קשיו",
          "quantity_g": 25.0,
          "calories_kcal": 138.2,
          "protein_g": 4.5,
          "carbs_g": 7.5,
          "fat_g": 11.0,
          "from_inventory": false,
          "inventory_item_id": null
        },
        {
          "food_id": "food_071",
          "food_name": "שוקולד מריר",
          "quantity_g": 15.6,
          "calories_kcal": 85.2,
          "protein_g": 0.9,
          "carbs_g": 9.4,
          "fat_g": 4.8,
          "from_inventory": false,
          "inventory_item_id": null
        }
      ],
      "totals": {
        "calories_kcal": 223.4,
        "protein_g": 5.4,
        "carbs_g": 16.9,
        "fat_g": 15.8
      }
    },
    {
      "meal_type": "lunch",
      "items": [
        {
          "food_id": "food_001",
          "food_name": "חזה עוף",
          "quantity_g": 150.0,
          "calories_kcal": 247.5,
          "protein_g": 46.5,
          "carbs_g": 0.0,
          "fat_g": 5.4,
          "from_inventory": true,
          "inventory_item_id": "4b657091-249a-4885-98f9-82e975813de0"
        },
        {
          "food_id": "food_013",
          "food_name": "סלמון",
          "quantity_g": 150.0,
          "calories_kcal": 312.0,
          "protein_g": 30.0,
          "carbs_g": 0.0,
          "fat_g": 19.5,
          "from_inventory": true,
          "inventory_item_id": "75b23a8d-5ce7-41c5-b50a-25b1d7a154c0"
        },
        {
          "food_id": "food_015",
          "food_name": "טופו",
          "quantity_g": 150.0,
          "calories_kcal": 114.0,
          "protein_g": 12.0,
          "carbs_g": 2.8,
          "fat_g": 7.2,
          "from_inventory": false,
          "inventory_item_id": null
        },
        {
          "food_id": "food_016",
          "food_name": "בטטה",
          "quantity_g": 125.2,
          "calories_kcal": 107.7,
          "protein_g": 2.0,
          "carbs_g": 25.0,
          "fat_g": 0.1,
          "from_inventory": false,
          "inventory_item_id": null
        }
      ],
      "totals": {
        "calories_kcal": 781.2,
        "protein_g": 90.5,
        "carbs_g": 27.8,
        "fat_g": 32.2
      }
    },
    {
      "meal_type": "afternoon_snack",
      "items": [
        {
          "food_id": "food_045",
          "food_name": "אורז חום",
          "quantity_g": 150.0,
          "calories_kcal": 166.5,
          "protein_g": 3.9,
          "carbs_g": 34.5,
          "fat_g": 1.4,
          "from_inventory": false,
          "inventory_item_id": null
        },
        {
          "food_id": "food_073",
          "food_name": "גרנולה",
          "quantity_g": 12.0,
          "calories_kcal": 56.5,
          "protein_g": 1.2,
          "carbs_g": 7.7,
          "fat_g": 2.4,
          "from_inventory": false,
          "inventory_item_id": null
        }
      ],
      "totals": {
        "calories_kcal": 223.0,
        "protein_g": 5.1,
        "carbs_g": 42.2,
        "fat_g": 3.8
      }
    },
    {
      "meal_type": "dinner",
      "items": [
        {
          "food_id": "food_047",
          "food_name": "חומוס",
          "quantity_g": 150.0,
          "calories_kcal": 246.0,
          "protein_g": 13.4,
          "carbs_g": 41.1,
          "fat_g": 3.9,
          "from_inventory": false,
          "inventory_item_id": null
        },
        {
          "food_id": "food_062",
          "food_name": "חומוס ממרח",
          "quantity_g": 50.0,
          "calories_kcal": 83.0,
          "protein_g": 4.0,
          "carbs_g": 7.2,
          "fat_g": 4.8,
          "from_inventory": false,
          "inventory_item_id": null
        },
        {
          "food_id": "food_074",
          "food_name": "תירס",
          "quantity_g": 100.0,
          "calories_kcal": 86.0,
          "protein_g": 3.3,
          "carbs_g": 19.0,
          "fat_g": 1.4,
          "from_inventory": false,
          "inventory_item_id": null
        },
        {
          "food_id": "food_075",
          "food_name": "אורז בסמטי",
          "quantity_g": 25.9,
          "calories_kcal": 31.3,
          "protein_g": 0.9,
          "carbs_g": 6.5,
          "fat_g": 0.1,
          "from_inventory": false,
          "inventory_item_id": null
        }
      ],
      "totals": {
        "calories_kcal": 446.3,
        "protein_g": 21.6,
        "carbs_g": 73.8,
        "fat_g": 10.2
      }
    }
  ],
  "target_calories_kcal": 2231.9,
  "totals": {
    "calories_kcal": 2127.0,
    "protein_g": 146.0,
    "carbs_g": 241.1,
    "fat_g": 67.3
  },
  "calorie_deviation_pct": -4.7,
  "created_at": "2026-04-05T11:34:53.994238+00:00"
}