{
  "plan_id": "8e120510-4b66-499c-9b2e-f42ffacb9d1e",
  "user_id": "variety_test",
  "run_id": "variety_run_0",
  "plan_date": "2026-04-08",
  "meals": [
    {
      "meal_type": "breakfast",
      "items": [
        {
          "food_id": "food_011",
          "food_name": "הודו",
          "quantity_g": 144.4,
          "calories_kcal": 194.9,
          "protein_g": 43.3,
          "carbs_g": 0.0,
          "fat_g": 1.4,
          "from_inventory": false,
          "inventory_item_id": null
        },
        {
          "food_id": "food_004",
          "food_name": "בננה",
          "quantity_g": 120.0,
          "calories_kcal": 106.8,
          "protein_g": 1.3,
          "carbs_g": 27.4,
          "fat_g": 0.4,
          "from_inventory": false,
          "inventory_item_id": null
        },
        {
          "food_id": "food_005",
          "food_name": "שמן זית",
          "quantity_g": 14.0,
          "calories_kcal": 123.8,
          "protein_g": 0.0,
          "carbs_g": 0.0,
          "fat_g": 14.0,
          "from_inventory": false,
          "inventory_item_id": null
        },
        {
          "food_id": "food_006",
          "food_name": "חלב",
          "quantity_g": 250.0,
          "calories_kcal": 105.0,
          "protein_g": 8.5,
          "carbs_g": 12.5,
          "fat_g": 2.5,
          "from_inventory": false,
          "inventory_item_id": null
        },
        {
          "food_id": "food_007",
          "food_name": "לחם מחיטה מלאה",
          "quantity_g": 30.0,
          "calories_kcal": 74.1,
          "protein_g": 3.9,
          "carbs_g": 12.3,
          "fat_g": 1.0,
          "from_inventory": false,
          "inventory_item_id": null
        }
      ],
      "totals": {
        "calories_kcal": 604.6,
        "protein_g": 57.0,
        "carbs_g": 52.2,
        "fat_g": 19.3
      }
    },
    {
      "meal_type": "morning_snack",
      "items": [
        {
          "food_id": "food_039",
          "food_name": "לבנה",
          "quantity_g": 50.0,
          "calories_kcal": 75.0,
          "protein_g": 3.0,
          "carbs_g": 2.0,
          "fat_g": 6.0,
          "from_inventory": false,
          "inventory_item_id": null
        },
        {
          "food_id": "food_054",
          "food_name": "גרעיני חמנייה",
          "quantity_g": 20.0,
          "calories_kcal": 116.8,
          "protein_g": 4.2,
          "carbs_g": 4.0,
          "fat_g": 10.3,
          "from_inventory": false,
          "inventory_item_id": null
        },
        {
          "food_id": "food_055",
          "food_name": "בוטנים",
          "quantity_g": 11.8,
          "calories_kcal": 66.9,
          "protein_g": 3.0,
          "carbs_g": 1.9,
          "fat_g": 5.8,
          "from_inventory": false,
          "inventory_item_id": null
        }
      ],
      "totals": {
        "calories_kcal": 258.7,
        "protein_g": 10.2,
        "carbs_g": 7.9,
        "fat_g": 22.1
      }
    },
    {
      "meal_type": "lunch",
      "items": [
        {
          "food_id": "food_003",
          "food_name": "ביצה",
          "quantity_g": 50.0,
          "calories_kcal": 77.5,
          "protein_g": 6.5,
          "carbs_g": 0.6,
          "fat_g": 5.5,
          "from_inventory": false,
          "inventory_item_id": null
        },
        {
          "food_id": "food_009",
          "food_name": "מלפפון",
          "quantity_g": 100.0,
          "calories_kcal": 15.0,
          "protein_g": 0.7,
          "carbs_g": 3.6,
          "fat_g": 0.1,
          "from_inventory": false,
          "inventory_item_id": null
        },
        {
          "food_id": "food_012",
          "food_name": "טונה",
          "quantity_g": 100.0,
          "calories_kcal": 116.0,
          "protein_g": 25.5,
          "carbs_g": 0.0,
          "fat_g": 1.0,
          "from_inventory": false,
          "inventory_item_id": null
        },
        {
          "food_id": "food_020",
          "food_name": "תפוח אדמה",
          "quantity_g": 200.0,
          "calories_kcal": 154.0,
          "protein_g": 4.0,
          "carbs_g": 34.0,
          "fat_g": 0.2,
          "from_inventory": false,
          "inventory_item_id": null
        },
        {
          "food_id": "food_048",
          "food_name": "שעועית שחורה",
          "quantity_g": 150.0,
          "calories_kcal": 198.0,
          "protein_g": 13.4,
          "carbs_g": 35.5,
          "fat_g": 0.8,
          "from_inventory": false,
          "inventory_item_id": null
        }
      ],
      "totals": {
        "calories_kcal": 560.5,
        "protein_g": 50.1,
        "carbs_g": 73.7,
        "fat_g": 7.6
      }
    },
    {
      "meal_type": "afternoon_snack",
      "items": [
        {
          "food_id": "food_066",
          "food_name": "מיץ תפוזים",
          "quantity_g": 250.0,
          "calories_kcal": 112.5,
          "protein_g": 1.8,
          "carbs_g": 26.0,
          "fat_g": 0.5,
          "from_inventory": false,
          "inventory_item_id": null
        },
        {
          "food_id": "food_067",
          "food_name": "חלב שקדים",
          "quantity_g": 250.0,
          "calories_kcal": 37.5,
          "protein_g": 1.5,
          "carbs_g": 0.8,
          "fat_g": 2.8,
          "from_inventory": false,
          "inventory_item_id": null
        },
        {
          "food_id": "food_068",
          "food_name": "קפה שחור",
          "quantity_g": 250.0,
          "calories_kcal": 5.0,
          "protein_g": 0.8,
          "carbs_g": 0.0,
          "fat_g": 0.0,
          "from_inventory": false,
          "inventory_item_id": null
        },
        {
          "food_id": "food_069",
          "food_name": "תה ירוק",
          "quantity_g": 250.0,
          "calories_kcal": 2.5,
          "protein_g": 0.0,
          "carbs_g": 0.5,
          "fat_g": 0.0,
          "from_inventory": false,
          "inventory_item_id": null
        },
        {
          "food_id": "food_070",
          "food_name": "חלב סויה",
          "quantity_g": 250.0,
          "calories_kcal": 82.5,
          "protein_g": 7.0,
          "carbs_g": 4.5,
          "fat_g": 4.5,
          "from_inventory": false,
          "inventory_item_id": null
        }
      ],
      "totals": {
        "calories_kcal": 240.0,
        "protein_g": 11.1,
        "carbs_g": 31.8,
        "fat_g": 7.8
      }
    },
    {
      "meal_type": "dinner",
      "items": [
        {
          "food_id": "food_049",
          "food_name": "אפונה ירוקה",
          "quantity_g": 100.0,
          "calories_kcal": 81.0,
          "protein_g": 5.4,
          "carbs_g": 14.5,
          "fat_g": 0.4,
          "from_inventory": false,
          "inventory_item_id": null
        },
        {
          "food_id": "food_061",
          "food_name": "רוטב סויה",
          "quantity_g": 15.0,
          "calories_kcal": 7.9,
          "protein_g": 1.2,
          "carbs_g": 0.7,
          "fat_g": 0.0,
          "from_inventory": false,
          "inventory_item_id": null
        },
        {
          "food_id": "food_062",
          "food_name": "חומוס ממרח",
          "quantity_g": 50.0,
          "calories_kcal": 83.0,
          "protein_g": 4.0,
          "carbs_g": 7.2,
          "fat_g": 4.8,
          "from_inventory": false,
          "inventory_item_id": null
        },
        {
          "food_id": "food_063",
          "food_name": "שמן שומשום",
          "quantity_g": 10.0,
          "calories_kcal": 88.4,
          "protein_g": 0.0,
          "carbs_g": 0.0,
          "fat_g": 10.0,
          "from_inventory": false,
          "inventory_item_id": null
        },
        {
          "food_id": "food_064",
          "food_name": "שמן קוקוס",
          "quantity_g": 10.0,
          "calories_kcal": 86.2,
          "protein_g": 0.0,
          "carbs_g": 0.0,
          "fat_g": 10.0,
          "from_inventory": false,
          "inventory_item_id": null
        }
      ],
      "totals": {
        "calories_kcal": 346.5,
        "protein_g": 10.6,
        "carbs_g": 22.4,
        "fat_g": 25.2
      }
    }
  ],
  "target_calories_kcal": 2586.6,
  "totals": {
    "calories_kcal": 2010.3,
    "protein_g": 139.0,
    "carbs_g": 188.0,
    "fat_g": 82.0
  },
  "calorie_deviation_pct": -22.3,
  "created_at": "2026-04-08T15:01:42.679734+00:00"
}