{
  "plan_id": "dd5a99bb-99f4-43fd-9627-a6179a229896",
  "user_id": "variety_test",
  "run_id": "variety_run_0",
  "plan_date": "2026-04-16",
  "meals": [
    {
      "meal_type": "breakfast",
      "items": [
        {
          "food_id": "food_002",
          "food_name": "אורז לבן",
          "quantity_g": 150.0,
          "calories_kcal": 195.0,
          "protein_g": 4.1,
          "carbs_g": 42.0,
          "fat_g": 0.4,
          "from_inventory": false,
          "inventory_item_id": null
        },
        {
          "food_id": "food_004",
          "food_name": "בננה",
          "quantity_g": 120.0,
          "calories_kcal": 106.8,
          "protein_g": 1.3,
          "carbs_g": 27.4,
          "fat_g": 0.4,
          "from_inventory": false,
          "inventory_item_id": null
        },
        {
          "food_id": "food_006",
          "food_name": "חלב",
          "quantity_g": 250.0,
          "calories_kcal": 105.0,
          "protein_g": 8.5,
          "carbs_g": 12.5,
          "fat_g": 2.5,
          "from_inventory": false,
          "inventory_item_id": null
        },
        {
          "food_id": "food_007",
          "food_name": "לחם מחיטה מלאה",
          "quantity_g": 30.0,
          "calories_kcal": 74.1,
          "protein_g": 3.9,
          "carbs_g": 12.3,
          "fat_g": 1.0,
          "from_inventory": false,
          "inventory_item_id": null
        },
        {
          "food_id": "food_017",
          "food_name": "שיבולת שועל",
          "quantity_g": 40.0,
          "calories_kcal": 155.6,
          "protein_g": 6.8,
          "carbs_g": 26.5,
          "fat_g": 2.8,
          "from_inventory": false,
          "inventory_item_id": null
        }
      ],
      "totals": {
        "calories_kcal": 636.5,
        "protein_g": 24.6,
        "carbs_g": 120.7,
        "fat_g": 7.1
      }
    },
    {
      "meal_type": "morning_snack",
      "items": [
        {
          "food_id": "food_025",
          "food_name": "שומשום",
          "quantity_g": 15.0,
          "calories_kcal": 86.0,
          "protein_g": 2.7,
          "carbs_g": 3.5,
          "fat_g": 7.5,
          "from_inventory": false,
          "inventory_item_id": null
        },
        {
          "food_id": "food_036",
          "food_name": "מנגו",
          "quantity_g": 150.0,
          "calories_kcal": 90.0,
          "protein_g": 1.2,
          "carbs_g": 22.5,
          "fat_g": 0.6,
          "from_inventory": false,
          "inventory_item_id": null
        },
        {
          "food_id": "food_037",
          "food_name": "יוגורט יווני",
          "quantity_g": 140.1,
          "calories_kcal": 82.7,
          "protein_g": 14.0,
          "carbs_g": 5.0,
          "fat_g": 1.0,
          "from_inventory": false,
          "inventory_item_id": null
        }
      ],
      "totals": {
        "calories_kcal": 258.7,
        "protein_g": 17.9,
        "carbs_g": 31.0,
        "fat_g": 9.1
      }
    },
    {
      "meal_type": "lunch",
      "items": [
        {
          "food_id": "food_001",
          "food_name": "חזה עוף",
          "quantity_g": 150.0,
          "calories_kcal": 247.5,
          "protein_g": 46.5,
          "carbs_g": 0.0,
          "fat_g": 5.4,
          "from_inventory": false,
          "inventory_item_id": null
        },
        {
          "food_id": "food_014",
          "food_name": "בקר טחון",
          "quantity_g": 150.0,
          "calories_kcal": 375.0,
          "protein_g": 39.0,
          "carbs_g": 0.0,
          "fat_g": 22.5,
          "from_inventory": false,
          "inventory_item_id": null
        },
        {
          "food_id": "food_018",
          "food_name": "פסטה",
          "quantity_g": 200.0,
          "calories_kcal": 262.0,
          "protein_g": 10.0,
          "carbs_g": 50.0,
          "fat_g": 2.2,
          "from_inventory": false,
          "inventory_item_id": null
        },
        {
          "food_id": "food_019",
          "food_name": "קינואה",
          "quantity_g": 17.3,
          "calories_kcal": 20.8,
          "protein_g": 0.8,
          "carbs_g": 3.7,
          "fat_g": 0.3,
          "from_inventory": false,
          "inventory_item_id": null
        }
      ],
      "totals": {
        "calories_kcal": 905.3,
        "protein_g": 96.3,
        "carbs_g": 53.7,
        "fat_g": 30.4
      }
    },
    {
      "meal_type": "afternoon_snack",
      "items": [
        {
          "food_id": "food_021",
          "food_name": "פיתה",
          "quantity_g": 60.0,
          "calories_kcal": 165.0,
          "protein_g": 5.5,
          "carbs_g": 33.4,
          "fat_g": 0.7,
          "from_inventory": false,
          "inventory_item_id": null
        },
        {
          "food_id": "food_041",
          "food_name": "שמנת חמוצה",
          "quantity_g": 30.0,
          "calories_kcal": 57.9,
          "protein_g": 0.6,
          "carbs_g": 1.4,
          "fat_g": 5.7,
          "from_inventory": false,
          "inventory_item_id": null
        },
        {
          "food_id": "food_080",
          "food_name": "לימון",
          "quantity_g": 30.0,
          "calories_kcal": 8.7,
          "protein_g": 0.3,
          "carbs_g": 2.8,
          "fat_g": 0.1,
          "from_inventory": false,
          "inventory_item_id": null
        },
        {
          "food_id": "food_085",
          "food_name": "קוטג'",
          "quantity_g": 27.6,
          "calories_kcal": 27.0,
          "protein_g": 3.0,
          "carbs_g": 0.9,
          "fat_g": 1.2,
          "from_inventory": false,
          "inventory_item_id": null
        }
      ],
      "totals": {
        "calories_kcal": 258.6,
        "protein_g": 9.4,
        "carbs_g": 38.5,
        "fat_g": 7.7
      }
    },
    {
      "meal_type": "dinner",
      "items": [
        {
          "food_id": "food_023",
          "food_name": "חמאת בוטנים",
          "quantity_g": 20.0,
          "calories_kcal": 117.6,
          "protein_g": 5.0,
          "carbs_g": 4.0,
          "fat_g": 10.0,
          "from_inventory": false,
          "inventory_item_id": null
        },
        {
          "food_id": "food_059",
          "food_name": "רוטב עגבניות",
          "quantity_g": 50.0,
          "calories_kcal": 14.5,
          "protein_g": 0.7,
          "carbs_g": 2.7,
          "fat_g": 0.2,
          "from_inventory": false,
          "inventory_item_id": null
        },
        {
          "food_id": "food_060",
          "food_name": "חרדל",
          "quantity_g": 10.0,
          "calories_kcal": 6.6,
          "protein_g": 0.4,
          "carbs_g": 0.5,
          "fat_g": 0.4,
          "from_inventory": false,
          "inventory_item_id": null
        },
        {
          "food_id": "food_061",
          "food_name": "רוטב סויה",
          "quantity_g": 15.0,
          "calories_kcal": 7.9,
          "protein_g": 1.2,
          "carbs_g": 0.7,
          "fat_g": 0.0,
          "from_inventory": false,
          "inventory_item_id": null
        },
        {
          "food_id": "food_062",
          "food_name": "חומוס ממרח",
          "quantity_g": 50.0,
          "calories_kcal": 83.0,
          "protein_g": 4.0,
          "carbs_g": 7.2,
          "fat_g": 4.8,
          "from_inventory": false,
          "inventory_item_id": null
        }
      ],
      "totals": {
        "calories_kcal": 229.6,
        "protein_g": 11.3,
        "carbs_g": 15.1,
        "fat_g": 15.4
      }
    }
  ],
  "target_calories_kcal": 2586.6,
  "totals": {
    "calories_kcal": 2288.7,
    "protein_g": 159.5,
    "carbs_g": 259.0,
    "fat_g": 69.7
  },
  "calorie_deviation_pct": -11.5,
  "created_at": "2026-04-16T16:56:25.245299+00:00"
}