{
  "plan_id": "7eeda1c4-5b84-4647-8c74-be6abcc8d18d",
  "user_id": "variety_test",
  "run_id": "variety_run_1",
  "plan_date": "2026-04-14",
  "meals": [
    {
      "meal_type": "breakfast",
      "items": [
        {
          "food_id": "food_011",
          "food_name": "הודו",
          "quantity_g": 122.2,
          "calories_kcal": 165.0,
          "protein_g": 36.7,
          "carbs_g": 0.0,
          "fat_g": 1.2,
          "from_inventory": false,
          "inventory_item_id": null
        },
        {
          "food_id": "food_024",
          "food_name": "גרעיני דלעת",
          "quantity_g": 20.0,
          "calories_kcal": 111.8,
          "protein_g": 6.0,
          "carbs_g": 2.1,
          "fat_g": 9.8,
          "from_inventory": false,
          "inventory_item_id": null
        },
        {
          "food_id": "food_027",
          "food_name": "תרד",
          "quantity_g": 100.0,
          "calories_kcal": 23.0,
          "protein_g": 2.9,
          "carbs_g": 3.6,
          "fat_g": 0.4,
          "from_inventory": false,
          "inventory_item_id": null
        },
        {
          "food_id": "food_030",
          "food_name": "חציל",
          "quantity_g": 150.0,
          "calories_kcal": 37.5,
          "protein_g": 1.5,
          "carbs_g": 9.0,
          "fat_g": 0.3,
          "from_inventory": false,
          "inventory_item_id": null
        },
        {
          "food_id": "food_034",
          "food_name": "ענבים",
          "quantity_g": 120.0,
          "calories_kcal": 82.8,
          "protein_g": 0.8,
          "carbs_g": 21.6,
          "fat_g": 0.2,
          "from_inventory": false,
          "inventory_item_id": null
        }
      ],
      "totals": {
        "calories_kcal": 420.1,
        "protein_g": 47.9,
        "carbs_g": 36.3,
        "fat_g": 11.9
      }
    },
    {
      "meal_type": "morning_snack",
      "items": [
        {
          "food_id": "food_035",
          "food_name": "אבטיח",
          "quantity_g": 200.0,
          "calories_kcal": 60.0,
          "protein_g": 1.2,
          "carbs_g": 15.2,
          "fat_g": 0.4,
          "from_inventory": false,
          "inventory_item_id": null
        },
        {
          "food_id": "food_036",
          "food_name": "מנגו",
          "quantity_g": 150.0,
          "calories_kcal": 90.0,
          "protein_g": 1.2,
          "carbs_g": 22.5,
          "fat_g": 0.6,
          "from_inventory": false,
          "inventory_item_id": null
        },
        {
          "food_id": "food_037",
          "food_name": "יוגורט יווני",
          "quantity_g": 170.0,
          "calories_kcal": 100.3,
          "protein_g": 17.0,
          "carbs_g": 6.1,
          "fat_g": 1.2,
          "from_inventory": false,
          "inventory_item_id": null
        }
      ],
      "totals": {
        "calories_kcal": 250.3,
        "protein_g": 19.4,
        "carbs_g": 43.8,
        "fat_g": 2.2
      }
    },
    {
      "meal_type": "lunch",
      "items": [
        {
          "food_id": "food_042",
          "food_name": "כוסמת",
          "quantity_g": 150.0,
          "calories_kcal": 138.0,
          "protein_g": 5.1,
          "carbs_g": 30.0,
          "fat_g": 0.9,
          "from_inventory": false,
          "inventory_item_id": null
        },
        {
          "food_id": "food_043",
          "food_name": "בורגול",
          "quantity_g": 150.0,
          "calories_kcal": 124.5,
          "protein_g": 4.7,
          "carbs_g": 27.9,
          "fat_g": 0.3,
          "from_inventory": false,
          "inventory_item_id": null
        },
        {
          "food_id": "food_044",
          "food_name": "קוסקוס",
          "quantity_g": 150.0,
          "calories_kcal": 168.0,
          "protein_g": 5.7,
          "carbs_g": 34.8,
          "fat_g": 0.3,
          "from_inventory": false,
          "inventory_item_id": null
        },
        {
          "food_id": "food_047",
          "food_name": "חומוס",
          "quantity_g": 150.0,
          "calories_kcal": 246.0,
          "protein_g": 13.4,
          "carbs_g": 41.1,
          "fat_g": 3.9,
          "from_inventory": false,
          "inventory_item_id": null
        },
        {
          "food_id": "food_050",
          "food_name": "שעועית לבנה",
          "quantity_g": 150.0,
          "calories_kcal": 208.5,
          "protein_g": 14.5,
          "carbs_g": 37.7,
          "fat_g": 0.6,
          "from_inventory": false,
          "inventory_item_id": null
        }
      ],
      "totals": {
        "calories_kcal": 885.0,
        "protein_g": 43.4,
        "carbs_g": 171.5,
        "fat_g": 6.0
      }
    },
    {
      "meal_type": "afternoon_snack",
      "items": [
        {
          "food_id": "food_038",
          "food_name": "גבינה צהובה",
          "quantity_g": 30.0,
          "calories_kcal": 105.0,
          "protein_g": 7.5,
          "carbs_g": 0.4,
          "fat_g": 8.1,
          "from_inventory": false,
          "inventory_item_id": null
        },
        {
          "food_id": "food_039",
          "food_name": "לבנה",
          "quantity_g": 50.0,
          "calories_kcal": 75.0,
          "protein_g": 3.0,
          "carbs_g": 2.0,
          "fat_g": 6.0,
          "from_inventory": false,
          "inventory_item_id": null
        },
        {
          "food_id": "food_040",
          "food_name": "גבינה בולגרית",
          "quantity_g": 32.8,
          "calories_kcal": 78.7,
          "protein_g": 4.6,
          "carbs_g": 0.3,
          "fat_g": 6.6,
          "from_inventory": false,
          "inventory_item_id": null
        }
      ],
      "totals": {
        "calories_kcal": 258.7,
        "protein_g": 15.1,
        "carbs_g": 2.7,
        "fat_g": 20.7
      }
    },
    {
      "meal_type": "dinner",
      "items": [
        {
          "food_id": "food_051",
          "food_name": "אדממה",
          "quantity_g": 100.0,
          "calories_kcal": 121.0,
          "protein_g": 11.9,
          "carbs_g": 8.6,
          "fat_g": 5.2,
          "from_inventory": false,
          "inventory_item_id": null
        },
        {
          "food_id": "food_058",
          "food_name": "טחינה",
          "quantity_g": 20.0,
          "calories_kcal": 119.0,
          "protein_g": 3.4,
          "carbs_g": 4.2,
          "fat_g": 10.8,
          "from_inventory": false,
          "inventory_item_id": null
        },
        {
          "food_id": "food_059",
          "food_name": "רוטב עגבניות",
          "quantity_g": 50.0,
          "calories_kcal": 14.5,
          "protein_g": 0.7,
          "carbs_g": 2.7,
          "fat_g": 0.2,
          "from_inventory": false,
          "inventory_item_id": null
        },
        {
          "food_id": "food_060",
          "food_name": "חרדל",
          "quantity_g": 10.0,
          "calories_kcal": 6.6,
          "protein_g": 0.4,
          "carbs_g": 0.5,
          "fat_g": 0.4,
          "from_inventory": false,
          "inventory_item_id": null
        },
        {
          "food_id": "food_076",
          "food_name": "חסה",
          "quantity_g": 80.0,
          "calories_kcal": 12.0,
          "protein_g": 1.1,
          "carbs_g": 2.3,
          "fat_g": 0.2,
          "from_inventory": false,
          "inventory_item_id": null
        }
      ],
      "totals": {
        "calories_kcal": 273.1,
        "protein_g": 17.5,
        "carbs_g": 18.3,
        "fat_g": 16.8
      }
    }
  ],
  "target_calories_kcal": 2586.6,
  "totals": {
    "calories_kcal": 2087.2,
    "protein_g": 143.3,
    "carbs_g": 272.6,
    "fat_g": 57.6
  },
  "calorie_deviation_pct": -19.3,
  "created_at": "2026-04-14T12:07:12.819866+00:00"
}